{
  "schema_version": 1,
  "record_count": 62,
  "sources": [
    "corpus-index.yml",
    "metadata/zenodo-records.json"
  ],
  "records": [
    {
      "section": "Instance réelle",
      "doi": "10.5281/zenodo.22571928",
      "public_title": "Observatorio Provincial de Transparencia de Sevilla — Consulta 1 — Informe de cierre longitudinal 2025–2026",
      "zenodo_title": "Observatorio Provincial de Transparencia de Sevilla — Consulta 1 — Informe de cierre longitudinal 2025–2026",
      "title_exact_match": true,
      "title_normalized_match": true,
      "record_id": "22571928",
      "concept_doi": "10.5281/zenodo.18263104",
      "publication_date": "2026-09-07",
      "version": "V3 · v1.0",
      "resource_type": "publication",
      "resource_subtype": "datapaper",
      "license": "cc-by-4.0",
      "language": "spa",
      "creators": [
        {
          "name": "Asociación Transparencia para la Ciudadanía (ATC)",
          "orcid": null,
          "affiliation": null
        }
      ],
      "keywords": [
        "transparencia pública",
        "derecho de acceso a la información pública",
        "administración local",
        "municipios",
        "Sevilla",
        "Observatorio Provincial de Transparencia",
        "Consejo de Transparencia y Protección de Datos de Andalucía",
        "investigación longitudinal",
        "trazabilidad",
        "reproducibilidad",
        "observabilidad democrática",
        "datos abiertos",
        "inteligencia artificial",
        "colaboración humano-IA"
      ],
      "zenodo_url": "https://zenodo.org/records/22571928"
    },
    {
      "section": "Instance réelle",
      "doi": "10.5281/zenodo.19486305",
      "public_title": "Entre el derecho y el silencio — Segunda consulta. Dataset auditado v2.1",
      "zenodo_title": "Primera Consulta del Observatorio Provincial de Transparencia (Sevilla): dataset auditado, memoria analítica y seguimiento del acceso a la información pública (2025)",
      "title_exact_match": false,
      "title_normalized_match": false,
      "record_id": "19486305",
      "concept_doi": "10.5281/zenodo.18263104",
      "publication_date": "2026-04-09",
      "version": "V2.1",
      "resource_type": "publication",
      "resource_subtype": "datapaper",
      "license": "cc-by-4.0",
      "language": "spa",
      "creators": [
        {
          "name": "Asociación de Transparencia para la Ciudadanía (ATC)",
          "orcid": null,
          "affiliation": null
        },
        {
          "name": "BARRERA ANGLADA, MANUEL",
          "orcid": "0009-0000-8891-7021",
          "affiliation": "Asociación Transparencia para la Ciudadanía (ATC)"
        }
      ],
      "keywords": [
        "transparency access to public information freedom of information local government municipal transparency administrative silence accountability open data public administration Seville Andalusia Spain"
      ],
      "zenodo_url": "https://zenodo.org/records/19486305"
    },
    {
      "section": "Instance réelle",
      "doi": "10.5281/zenodo.19445703",
      "public_title": "Primera Consulta — dataset auditado y análisis del acceso a la información pública (2025)",
      "zenodo_title": "Primera Consulta del Observatorio Provincial de Transparencia (Sevilla): dataset auditado y análisis del acceso a la información pública (2025)",
      "title_exact_match": false,
      "title_normalized_match": false,
      "record_id": "19445703",
      "concept_doi": "10.5281/zenodo.18263104",
      "publication_date": "2026-04-07",
      "version": "2.0",
      "resource_type": "dataset",
      "resource_subtype": null,
      "license": "cc-by-4.0",
      "language": "spa",
      "creators": [
        {
          "name": "Asociación de Transparencia para la Ciudadanía (ATC)",
          "orcid": null,
          "affiliation": null
        },
        {
          "name": "BARRERA ANGLADA, MANUEL",
          "orcid": "0009-0000-8891-7021",
          "affiliation": "Asociación Transparencia para la Ciudadanía"
        }
      ],
      "keywords": [
        "transparencia acceso a la información pública administrative transparency freedom of information local government open data accountability silencio administrativo public administration Spain"
      ],
      "zenodo_url": "https://zenodo.org/records/19445703"
    },
    {
      "section": "Instance réelle",
      "doi": "10.5281/zenodo.18263105",
      "public_title": "Primera Consulta — resultados y análisis de las solicitudes de acceso a la información pública (2025)",
      "zenodo_title": "Primera Consulta del Observatorio Provincial de Transparencia (Sevilla) Resultados y análisis de las solicitudes de acceso a la información pública (2025)",
      "title_exact_match": false,
      "title_normalized_match": false,
      "record_id": "18263105",
      "concept_doi": "10.5281/zenodo.18263104",
      "publication_date": "2026-01-16",
      "version": "v 1.2",
      "resource_type": "publication",
      "resource_subtype": "report",
      "license": "cc-by-4.0",
      "language": "spa",
      "creators": [
        {
          "name": "Asociación de Transparencia para la Ciudadanía (ATC)",
          "orcid": null,
          "affiliation": null
        },
        {
          "name": "BARRERA ANGLADA, MANUEL",
          "orcid": "0009-0000-8891-7021",
          "affiliation": "Asociación Transparencia para la Ciudadanía"
        }
      ],
      "keywords": [
        "Transparencia acceso a la información pública administración local silencio administrativo Observatorio de transparencia datos abiertos gobernanza Andalucía"
      ],
      "zenodo_url": "https://zenodo.org/records/18263105"
    },
    {
      "section": "Instance réelle",
      "doi": "10.5281/zenodo.17644322",
      "public_title": "Reclamación ante el Consejo de Transparencia (Expediente ATC-2025/01)",
      "zenodo_title": "Reclamación ante el Consejo de Transparencia y Protección de Datos de Andalucía por falta de resolución expresa en solicitudes de acceso a la información pública (Expediente ATC-2025/01)",
      "title_exact_match": false,
      "title_normalized_match": false,
      "record_id": "17644322",
      "concept_doi": "10.5281/zenodo.17562637",
      "publication_date": "2025-11-18",
      "version": "V2 – Contacto institucional con Diputación (registro de entrada 77710 18/11/2025)",
      "resource_type": "publication",
      "resource_subtype": "report",
      "license": "cc-by-4.0",
      "language": "spa",
      "creators": [
        {
          "name": "Asociación Transparencia para la Ciudadanía (ATC)",
          "orcid": null,
          "affiliation": null
        },
        {
          "name": "BARRERA ANGLADA, MANUEL",
          "orcid": "0009-0000-8891-7021",
          "affiliation": "Asociación Transparencia para la Ciudadanía (ATC)"
        }
      ],
      "keywords": [
        "transparencia pública",
        "derecho de acceso a la información",
        "silencio administrativo",
        "Consejo de Transparencia de Andalucía",
        "REGAGE/SIR",
        "PTC-ATC",
        "ACS-5",
        "reclamación administrativa",
        "asociaciones ciudadanas",
        "trazabilidad documental",
        "Diputación de Sevilla"
      ],
      "zenodo_url": "https://zenodo.org/records/17644322"
    },
    {
      "section": "Instance réelle",
      "doi": "10.5281/zenodo.17562638",
      "public_title": "Reclamación ante el Consejo de Transparencia y Protección de Datos de Andalucía por falta de resolución expresa en solicitudes de acceso a la información pública (Expediente ATC-2025/01)",
      "zenodo_title": "Reclamación ante el Consejo de Transparencia y Protección de Datos de Andalucía por falta de resolución expresa en solicitudes de acceso a la información pública (Expediente ATC-2025/01)",
      "title_exact_match": true,
      "title_normalized_match": true,
      "record_id": "17562638",
      "concept_doi": "10.5281/zenodo.17562637",
      "publication_date": "2025-11-09",
      "version": "1.0 (V1) – Reclamación formal presentada ante el Consejo de Transparencia y Protección de Datos de Andalucía",
      "resource_type": "publication",
      "resource_subtype": "report",
      "license": "cc-by-4.0",
      "language": "spa",
      "creators": [
        {
          "name": "Asociación Transparencia para la Ciudadanía (ATC)",
          "orcid": null,
          "affiliation": null
        },
        {
          "name": "BARRERA ANGLADA, MANUEL",
          "orcid": "0009-0000-8891-7021",
          "affiliation": "Asociación Transparencia para la Ciudadanía (ATC)"
        }
      ],
      "keywords": [
        "transparencia pública",
        "derecho de acceso a la información",
        "silencio administrativo",
        "Consejo de Transparencia de Andalucía",
        "REGAGE/SIR",
        "PTC-ATC",
        "ACS-5",
        "reclamación administrativa",
        "asociaciones ciudadanas",
        "trazabilidad documental"
      ],
      "zenodo_url": "https://zenodo.org/records/17562638"
    },
    {
      "section": "Essais · Portes d’entrée",
      "doi": "10.5281/zenodo.22977400",
      "public_title": "La sal del eclipse",
      "zenodo_title": "La sal del eclipse",
      "title_exact_match": true,
      "title_normalized_match": true,
      "record_id": "22977400",
      "concept_doi": "10.5281/zenodo.22977399",
      "publication_date": "2026-09-28",
      "version": "1.0",
      "resource_type": "publication",
      "resource_subtype": "book",
      "license": "cc-by-4.0",
      "language": "spa",
      "creators": [
        {
          "name": "Barrera Anglada, Manuel",
          "orcid": "0009-0000-8891-7021",
          "affiliation": null
        }
      ],
      "keywords": [
        "Human–AI intermediation",
        "Intermediación humano–IA",
        "Human–AI collaboration",
        "Colaboración humano–IA",
        "AI transparency",
        "Trazabilidad de IA",
        "Human agency",